{
  "$schema": "./security-alert-policies.schema.json",
  "version": "1.0.0",
  "status": "design-only",
  "projectId": "black-book-efaaf",
  "bead": "BB-034",
  "policies": [
    {
      "id": "SEC-ARMOR-01",
      "kind": "armor.throttle",
      "severity": "warning",
      "runbookId": "runbook/armor-throttle-spike",
      "description": "Armor throttle rate exceeds baseline",
      "notificationChannels": ["security_alerts"],
      "metric": "armor_throttles_total",
      "windowMs": 300000,
      "threshold": 100,
      "comparator": "gt",
      "immediateNotification": false,
      "enabled": true
    },
    {
      "id": "SEC-ARMOR-02",
      "kind": "armor.deny",
      "severity": "warning",
      "runbookId": "runbook/armor-deny-spike",
      "description": "Armor WAF deny rate exceeds baseline",
      "notificationChannels": ["security_alerts"],
      "metric": "armor_denies_total",
      "windowMs": 600000,
      "threshold": 50,
      "comparator": "gt",
      "immediateNotification": false,
      "enabled": true
    },
    {
      "id": "SEC-CLIENT-01",
      "kind": "client_header.failure",
      "severity": "warning",
      "runbookId": "runbook/client-header-failures",
      "description": "Client-header failure burst",
      "notificationChannels": ["security_alerts"],
      "metric": "client_header_failures_total",
      "windowMs": 300000,
      "threshold": 25,
      "comparator": "gt",
      "immediateNotification": false,
      "enabled": true
    },
    {
      "id": "SEC-AUTH-01",
      "kind": "authentication.failure",
      "severity": "warning",
      "runbookId": "runbook/auth-failure-spike",
      "description": "Authentication failure spike",
      "notificationChannels": ["security_alerts"],
      "metric": "authentication_failures_total",
      "windowMs": 300000,
      "threshold": 30,
      "comparator": "gt",
      "immediateNotification": false,
      "enabled": true
    },
    {
      "id": "SEC-ADMIN-01",
      "kind": "administrator.role_changed",
      "severity": "critical",
      "runbookId": "runbook/admin-role-change",
      "description": "Any administrator role change",
      "notificationChannels": ["pager", "security_alerts"],
      "metric": "administrator_role_changes_total",
      "windowMs": 60000,
      "threshold": 0,
      "comparator": "gt",
      "immediateNotification": true,
      "enabled": true
    },
    {
      "id": "SEC-SUB-01",
      "kind": "submission.spike",
      "severity": "warning",
      "runbookId": "runbook/submission-spike",
      "description": "Submission intake spike",
      "notificationChannels": ["security_alerts"],
      "metric": "submission_requests_total",
      "windowMs": 300000,
      "threshold": 200,
      "comparator": "gt",
      "immediateNotification": false,
      "enabled": true
    },
    {
      "id": "SEC-SEARCH-01",
      "kind": "search.abuse",
      "severity": "warning",
      "runbookId": "runbook/search-abuse",
      "description": "Search guardrail denial burst",
      "notificationChannels": ["security_alerts"],
      "metric": "search_guardrail_denials_total",
      "windowMs": 300000,
      "threshold": 40,
      "comparator": "gt",
      "immediateNotification": false,
      "enabled": true
    },
    {
      "id": "SEC-GEO-01",
      "kind": "geocoder.abuse",
      "severity": "warning",
      "runbookId": "runbook/geocoder-abuse",
      "description": "Geocoder abuse denial burst",
      "notificationChannels": ["security_alerts"],
      "metric": "geocoder_guardrail_denials_total",
      "windowMs": 300000,
      "threshold": 40,
      "comparator": "gt",
      "immediateNotification": false,
      "enabled": true
    },
    {
      "id": "SEC-DB-01",
      "kind": "database.slow_query",
      "severity": "warning",
      "runbookId": "runbook/slow-query",
      "description": "Slow query rate exceeds threshold",
      "notificationChannels": ["security_alerts"],
      "metric": "database_slow_queries_total",
      "windowMs": 600000,
      "threshold": 10,
      "comparator": "gt",
      "immediateNotification": false,
      "enabled": true
    },
    {
      "id": "SEC-DB-02",
      "kind": "database.unexpected_public_write",
      "severity": "critical",
      "runbookId": "runbook/unexpected-public-write",
      "description": "Unexpected public schema write detected",
      "notificationChannels": ["pager", "security_alerts"],
      "metric": "database_unexpected_public_writes_total",
      "windowMs": 60000,
      "threshold": 0,
      "comparator": "gt",
      "immediateNotification": true,
      "enabled": true
    },
    {
      "id": "SEC-QUEUE-01",
      "kind": "queue.depth",
      "severity": "warning",
      "runbookId": "runbook/queue-depth",
      "description": "Queue depth exceeds safe operating level",
      "notificationChannels": ["security_alerts"],
      "metric": "queue_depth",
      "windowMs": 300000,
      "threshold": 500,
      "comparator": "gt",
      "immediateNotification": false,
      "enabled": true
    },
    {
      "id": "SEC-QUEUE-02",
      "kind": "queue.retry",
      "severity": "warning",
      "runbookId": "runbook/queue-retries",
      "description": "Queue retry burst",
      "notificationChannels": ["security_alerts"],
      "metric": "queue_retries_total",
      "windowMs": 600000,
      "threshold": 50,
      "comparator": "gt",
      "immediateNotification": false,
      "enabled": true
    },
    {
      "id": "SEC-SRC-01",
      "kind": "source_adapter.anomaly",
      "severity": "critical",
      "runbookId": "runbook/source-adapter-anomaly",
      "description": "Source adapter anomaly burst",
      "notificationChannels": ["security_alerts"],
      "metric": "source_adapter_anomalies_total",
      "windowMs": 600000,
      "threshold": 5,
      "comparator": "gt",
      "immediateNotification": false,
      "enabled": true
    },
    {
      "id": "SEC-PUB-01",
      "kind": "publication.activity",
      "severity": "critical",
      "runbookId": "runbook/publication-change",
      "description": "Publication or release activation event",
      "notificationChannels": ["pager", "security_alerts"],
      "metric": "publication_events_total",
      "windowMs": 60000,
      "threshold": 0,
      "comparator": "gt",
      "immediateNotification": true,
      "enabled": true
    },
    {
      "id": "SEC-RET-01",
      "kind": "retraction.activity",
      "severity": "critical",
      "runbookId": "runbook/retraction-change",
      "description": "Retraction or reversal event",
      "notificationChannels": ["pager", "security_alerts"],
      "metric": "retraction_events_total",
      "windowMs": 60000,
      "threshold": 0,
      "comparator": "gt",
      "immediateNotification": true,
      "enabled": true
    },
    {
      "id": "SEC-STOR-01",
      "kind": "storage.access_denied",
      "severity": "warning",
      "runbookId": "runbook/storage-denial",
      "description": "Storage access denial burst",
      "notificationChannels": ["security_alerts"],
      "metric": "storage_access_denials_total",
      "windowMs": 600000,
      "threshold": 20,
      "comparator": "gt",
      "immediateNotification": false,
      "enabled": true
    },
    {
      "id": "SEC-ERR-01",
      "kind": "service.error_rate",
      "severity": "critical",
      "runbookId": "runbook/error-rate-spike",
      "description": "Service error rate spike",
      "notificationChannels": ["security_alerts"],
      "metric": "service_errors_total",
      "windowMs": 300000,
      "threshold": 25,
      "comparator": "gt",
      "immediateNotification": false,
      "enabled": true
    },
    {
      "id": "SEC-LAT-01",
      "kind": "service.latency",
      "severity": "warning",
      "runbookId": "runbook/latency-spike",
      "description": "p95 latency exceeds SLO",
      "notificationChannels": ["security_alerts"],
      "metric": "service_latency_ms",
      "windowMs": 300000,
      "threshold": 2000,
      "comparator": "gt",
      "immediateNotification": false,
      "enabled": true
    },
    {
      "id": "SEC-COST-01",
      "kind": "cost.anomaly",
      "severity": "critical",
      "runbookId": "runbook/cost-anomaly",
      "description": "Cost anomaly score exceeds budget guardrail",
      "notificationChannels": ["security_alerts"],
      "metric": "cost_anomaly_score",
      "windowMs": 3600000,
      "threshold": 75,
      "comparator": "gte",
      "immediateNotification": false,
      "enabled": true
    }
  ]
}
